{
  "condition": "violation",
  "events": [
    {
      "authority_expired": true,
      "event": "delayed-response",
      "legal_keys": [
        "MOVE:frog-1:STEP-E",
        "MOVE:frog-1:STEP-N",
        "ANIMATE:frog-1:hop",
        "NOOP"
      ],
      "notes": "Injected source violation: expired response executes.",
      "page": "farm",
      "principal": "omega-jev",
      "receipt": {
        "accepted": true,
        "action": "move-sticker",
        "actor": "agent-1",
        "basedOnRevision": 3,
        "commandId": "c8",
        "object": "frog-1",
        "reason": "accepted",
        "replayed": false,
        "requestedBy": "child-1",
        "resultRevision": 5,
        "selectedBy": "omega-jev",
        "translatedBy": "omega-llm"
      },
      "revision_before": 4,
      "route": "delayed-response",
      "selected_key": "MOVE:frog-1:STEP-E",
      "selected_key_source": "host-table",
      "state_delta": [
        {
          "object": "frog-1",
          "op": "move",
          "page": "farm",
          "x": 0.62,
          "y": 0.5
        }
      ],
      "t": 0.0
    }
  ],
  "fixture_kind": "synthetic-calibration",
  "ground_truth": {
    "invariant_satisfied": false,
    "notes": "Synthetic stale-response acceptance perturbation.",
    "violation_class": "stale_response_executed"
  },
  "invariant": "stale_response_rejection",
  "schema_version": "0.1",
  "trace_id": "stale-response.violation"
}
